"Menu Item ID","Parent 1","Parent 2","Parent 3","Parent 4","Menu Number","Menu Item Number","Levels","Label","Label","Content"
"a1L360000010BIF","Café Especial - Comercio Justo.","Café Especial - Sostenible.","Sellos de Café Especial en el Mundo.","CAFÉS ESPECIALES.","M-0000000000","MI-0000000330","5","CULTIVO DE CAFÉ.","Objetivo de café Comercio Justo.","El sello de comercio justo es una forma de cooperación comercial con el fin de mejorar las posibilidades de pequeños productores y sus organizaciones para sobrevivir en la competencia económica internacional. En el sistema se ofrecen relaciones comerciales de largo plazo, la posibilidad de recibir pagos anticipados y un precio que cubra todos los gastos de producción. Las compras se hacen sin intermediarios innecesarios. La justicia y el respeto de los derechos humanos conforman la base de la cooperación. Mientras la situación social y económica de los productores mejora, también es posible tener en cuenta la situación ecológica y así fomentar el desarrollo sostenible. 

(CENICAFE, 2007)"
"a1L360000010BIK","Café Especial - Comercio Justo.","Café Especial - Sostenible.","Sellos de Café Especial en el Mundo.","CAFÉS ESPECIALES.","M-0000000000","MI-0000000331","5","CULTIVO DE CAFÉ.","Compromisos del caficultor.","?	La posibilidad de un comercio directo y justo con los productores el tercer mundo. 
?	Los productores reciben una recompensa que cubre los costos de la producción. 
?	Los productores se comprometen a cumplir los acuerdos básicos de la Organización Internacional del Trabajo (OIT), la Declaración Universal de los Derechos Humanos de la ONU y la Declaración de los Derechos del Niño. 
?	Se garantizan a los productores acuerdos de largo plazo y la posibilidad de recibir prepagos. 
?	Los productos se compran directamente a las organizaciones productoras sin intermediarios innecesarios. 
?	El sistema ofrece a los pequeños agricultores y a las fincas familiares una posibilidad de tomar parte en el comercio. 
?	Los trabajadores tienen el derecho de organizarse y sindicalizarse. 
?	Los productores se comprometen a cumplir las normas de protección del medio ambiente. 
?	Los productos deben elaborarse sin el empleo de mano de obra infantil. Es prohibido que niños menores de 14 años trabajen. 
?	El productor recibe un pago adicional si su café proviene de la producción orgánica. 

(CENICAFE, 2007)"
"a1L360000010BI5","Café Especial - Comercio Justo.","Café Especial - Sostenible.","Sellos de Café Especial en el Mundo.","CAFÉS ESPECIALES.","M-0000000000","MI-0000000329","5","CULTIVO DE CAFÉ.","Características del café Comercio Justo.","Son cafés producidos por pequeños productores asociados en cooperativas y que tienen un precio mínimo de compra garantizado. Las relaciones comerciales están basadas en el respeto y beneficio mutuo de las partes. Se valora el trabajo de los productores, las leyes laborales, la seguridad social, la salubridad y el respeto por la conservación de los recursos naturales. 

(CENICAFE, 2007)"
"a1L360000010BEl","Café Especial - Amigables con las Aves.","Café Especial - Sostenible.","Sellos de Café Especial en el Mundo.","CAFÉS ESPECIALES.","M-0000000000","MI-0000000323","5","CULTIVO DE CAFÉ.","Requisitos.","Para tramitar el sello debe contarse primero con certificaciones orgánicas y de cultivo bajo sombra. El Centro promueve la reconversión de las fincas al cultivo bajo sombra y después al Amigable con las Aves. Además, ha emitido una serie de definiciones y criterios generales para la certificación. 

(CENICAFE, 2007)"
"a1L360000010BEb","Café Especial - Amigables con las Aves.","Café Especial - Sostenible.","Sellos de Café Especial en el Mundo.","CAFÉS ESPECIALES.","M-0000000000","MI-0000000322","5","CULTIVO DE CAFÉ.","Características del café Amigables con las aves.","Este café crece y se cultiva a la sombra de una cubierta arbórea, en contraste con las fincas cafeteras en las que el café se cultiva a plena exposición solar, o aquellas completamente tecnificadas que tienen muy pocos árboles o carecen de ellos totalmente. 

El café producido de forma sostenible debe provenir de una plantación con alta diversidad biológica y con un uso limitado de sustancias químicas. En los sistemas de producción deben conservarse los recursos existentes, proteger el ambiente, producir con eficiencia, competir en el mercado e impulsar la calidad de vida de los productores y de la sociedad en su conjunto.

En 1998 se creó el programa para conceder la licencia a importadores, tostadores y comercializadores en el uso del sello ?Bird Friendly?, con el cual se garantiza un apoyo de 25 centavos por libra al café tostado con certificación. Este dinero se envía al SMBC y se destina para proyectos de investigación, estudios en proceso, entrenamiento y educación para productores y consumidores sobre temas del cultivo de café bajo sombra. 

(CENICAFE, 2007)"
"a1L360000010BEM","Café Especial - Orgánicos.","Café Especial - Sostenible.","Sellos de Café Especial en el Mundo.","CAFÉS ESPECIALES.","M-0000000000","MI-0000000320","5","CULTIVO DE CAFÉ.","Objetivos de los Orgánicos.","?	Ofrecer una caficultura económicamente viable, socialmente justa y ambientalmente responsable. 
?	Propiciar un efecto multiplicador sobre el desarrollo local, regional y nacional. 
?	Conservar y mantener la mayor diversidad biológica dentro de los ecosistemas cafeteros. 
?	Fomentar los ciclos biológicos dentro de los sistemas cafeteros, y mantener y aumentar la fertilidad de los suelos mediante prácticas adecuadas de conservación. 
?	Aprovechar racionalmente los recursos renovables de la finca y evitar todas las formas de contaminación ambiental, producto de las prácticas de cultivo y beneficio del café. 
?	Producir café de excelente calidad y en cantidad tal que satisfaga los mercados externos e internos. 

(CENICAFE, 2007)"
"a1L360000010BEH","Café Especial - Orgánicos.","Café Especial - Sostenible.","Sellos de Café Especial en el Mundo.","CAFÉS ESPECIALES.","M-0000000000","MI-0000000319","5","CULTIVO DE CAFÉ.","Características de los Orgánicos.","Son los cafés cultivados sin la utilización de productos Agroquímicos como fungicidas, herbicidas, insecticidas y fertilizantes. Normalmente, se comercializan con una certificación expedida por una firma especializada, encargada de inspeccionar y vigilar las prácticas del cultivo, su proceso de trilla, almacenamiento y transporte. (CENICAFE, 2007)

Toda finca cafetera que desee comercializar su café bajo la denominación de orgánico deberá someterse a un proceso de certificación por un organismo certificador. Las fincas deberán poseer una ficha histórica, un plan de producción y un mapa. Para la certificación de una finca cafetera como orgánica es necesario tener registros de las compras de insumos (empaque, abonos), mano de obra, volumen de café pergamino seco producido, facturas de venta del café y haber cumplido con el período de conversión. 

(CENICAFE, 2007)"
"a1L360000010BF0","Café Especial - UTZ.","Café Especial - Sostenible.","Sellos de Café Especial en el Mundo.","CAFÉS ESPECIALES.","M-0000000000","MI-0000000326","5","CULTIVO DE CAFÉ.","Características del Café UTZ.","Este código contiene criterios para el manejo de suelos, el uso de fertilizantes, el manejo integrado de pesticidas, el manejo de residuos de polución, la salud de los trabajadores, la seguridad y el bienestar, y otros aspectos socioeconómicos y culturales. Utz Certified tiene como objetivos garantizar el acceso a los servicios sociales básicos, guiar a los productores para armonizar los estándares para la producción de café sostenible y proporcionar la asistencia para la aplicación de estos estándares. La fundación registra a los productores interesados y proporciona el código de conducta; así mismo, establece contacto con una agencia de certificación independiente, la cual realiza las inspecciones y otorga el certificado si se cumplen los estándares y como contraprestación los tostadores pagan una cuota de US$ 0, 01/kg para la fundación. 

(CENICAFE, 2007)"
"a1L360000010BIU","Café Especial - 4C.","Café Especial - Sostenible.","Sellos de Café Especial en el Mundo.","CAFÉS ESPECIALES.","M-0000000000","MI-0000000333","5","CULTIVO DE CAFÉ.","Características del café 4C.","La Asociación 4C es la plataforma que reúne a las partes interesadas del sector del café para tratar los temas de la sostenibilidad con un enfoque precompetitivo.

Hasta la fecha, más de 225 miembros ya se han sumado a la plataforma de 4C, entre ellos:

?	organizaciones de caficultores
?	comercializadoras (importadoras y exportadoras)
?	representantes de la industria (tostadoras y minoristas)
?	organizaciones de la sociedad civil

Esta comunidad global trabaja unida para mejorar las condiciones económicas, sociales y ambientales de quienes se ganan la vida con el café. 

El Código de Conducta de 4C es una herramienta que permite dar asistencia a los agricultores en el proceso de aplicación de mejores prácticas agrícolas, de procesamiento y de gestión. Asimismo, con la ayuda de las Unidades 4C, los agricultores y otros socios de negocio crean puentes para hacer llegar información, herramientas y capacitación para los siguientes fines:

?	Aumentar los rendimientos mediante la aplicación de mejores prácticas agrícolas y el acceso a nuevas tecnologías, materiales para plantar, etc.
?	Mejorar la calidad del café cosechando granos de mejor calidad o procesándolos, secándolos y almacenándolos correctamente para preservar la calidad.
?	Reducir al mínimo y hacer el mejor uso posible de los pesticidas y los fertilizantes aprobados, y aplicar estrategias integrales de gestión de plagas a fin de mitigar los daños al medio ambiente y bajar los costos.
?	Mantener registros de las actividades de producción, con vistas a monitorear los costos y a identificar oportunidades para aumentar la eficiencia.
?	Impulsar el desarrollo organizativo y la capacidad de gestión de los grupos de agricultores, para mejorar la prestación de servicios.
La adopción de estas prácticas contribuye a incrementar el ingreso neto de los caficultores mediante la mejora de la calidad, la reducción de costos, la mayor eficiencia y la optimización de la cadena de suministro.

(4C-ASSOCIATION, 2012)"
"a1L360000010BI0","Café Especial - Rainforest Alliance.","Café Especial - Sostenible.","Sellos de Café Especial en el Mundo.","CAFÉS ESPECIALES.","M-0000000000","MI-0000000328","5","CULTIVO DE CAFÉ.","Características del café Rainforest Alliance.","La Rainforest Alliance (RA) propende por la protección de los ecosistemas y las personas, así como la vida silvestre que en ellos habita, al transformar las prácticas en el uso de la tierra, en la industria y en el comportamiento de los consumidores. Las empresas, las cooperativas y los caficultores que participan en los programas RA deben cumplir con rigurosos estándares que conservan la biodiversidad y proveen medios de vida sostenibles como:

?	La planificación, la ejecución y el monitoreo del sistema de gestión socio-ambiental. 
?	La conservación de ecosistemas. 
?	La protección de la vida silvestre. 
?	La conservación de recursos hídricos. 
?	El trato justo y las buenas condiciones para los trabajadores. 
?	Las relaciones con la comunidad. 
?	 El manejo integrado del cultivo. 
?	El manejo y conservación del suelo. 
?	 El manejo integrado de desechos."
"a1L36000003OF6J","Producción de la finca.","Beauveria Bassiana.","Hongos.","ALTERNATIVAS DE BIOPREPARADOS.","M-0000000005","MI-0000000453","5","BIOPREPARADOS.","2 - Esterilización del medio de cultivo.","ESTERILIZACIÓN DEL MEDIO DE CULTIVO.
A nivel de finca la esterilización se puede hacer en olla a presión (pitadora) o en ollas corrientes, en Baño de María.

A - Olla a presión.
A la olla se le agrega agua en el fondo a ras de una parrilla o soporte sobre la cual se depositan las botellas, horizontalmente, ligeramente inclinadas y teniendo cuidando que se distribuya el arroz uniformemente y que el tapón de algodón NO se moje. Las botellas se colocan unas sobre otras hasta llenar la olla. La olla se tapa y se coloca en la estufa. Una vez se inicie la evaporación y se levante la válvula completamente, se deja ""pitar"" 15 minutos más en la estufa. Este es el tiempo en el cual el arroz se cocina y queda esterilizado.Luego se debe extraer el vapor de la olla y dejar enfriar.  

B - Olla corriente. 
Para esterilizar el medio de cultivo al ""Baño de María"" la más indicada es una olla alta, con tapa, preferiblemente de gran capacidad para que permita esterilizar un alto número de botellas en un solo proceso. En la olla no hay que colocar sobre-fondo. Las botellas se colocan paradas, juntas y apretadas para evitar que se volteen cuando el agua comience a hervir, o se mojen los tapones y penetre agua de la olla en el medio de cultivo.

Después de colocar las botellas se adiciona agua a la olla y el nivel debe superar el del agua que está dentro de las botellas. Se tapa la olla y se coloca en la estufa. Después que comience a hervir se cuentan 30 minutos, tiempo en el cual se logra que el arroz quede cocinado y esterilizado.

IMPORTANTE.
Si el medio de cultivo, en ambos casos, se deja mayor tiempo que el indicado, se puede quemar o deshidratarse en exceso, lo cual afecta el crecimiento y desarrollo normal del hongo. El proceso de esterilización se puede realizar en la cocina de la finca. En un día de trabajo se pueden esterilizar varios grupos de botellas. 

Luego de realizar la esterilización y si al retirar las botellas aún están calientes, se deben colocar sobre una superficie de madera, cartón o tela, para evitar que se quiebren, como ocurre cuando se  colocan sobre una superficie de baldosa o cemento que esté fría. Las botellas con los medios esterilizados se trasladan al cuarto de siembra, sin remover en ningún caso los tapones, donde deben ser inoculadas en una sola sesión de siembra del hongo. 

CENICAFE"
"a1L36000003OF69","Producción de la finca.","Beauveria Bassiana.","Hongos.","ALTERNATIVAS DE BIOPREPARADOS.","M-0000000005","MI-0000000452","5","BIOPREPARADOS.","1 - Preparación del medio de cultivo.","PREPARACIÓN DEL MEDIO DE CULTIVO.
Para la producción del hongo se usan botellas de vidrio puestas previamente en remojo en una solución de detergente e hipoclorito de sodio ""límpido""a las cuales se les remueven las etiquetas. Las botellas deben ser de boca angosta para disminuirlos riesgos de contaminación y preferiblemente transparentes, para que se facilite la evaluación del crecimiento y desarrollo del hongo, y la observación de posibles agentes contaminantes. Además se requiere el sustrato.

En botellas aplanadas de 375 ml de capacidad se utilizan 50 gramos de arroz de cualquier calidad (sin lavar) y 80 ml de agua corriente. Las botellas se tapan con algodón o gasa. Se debe tener cuidado que los tapones queden bien ajustados a la boca de la botella para evitar que se contamine el medio de cultivo después de esterilizado. El tapón no debe penetrar más allá del cuello dela botella. 

CENICAFE"
"a1L36000003OFCL","Producción de la finca.","Beauveria Bassiana.","Hongos.","ALTERNATIVAS DE BIOPREPARADOS.","M-0000000005","MI-0000000454","5","BIOPREPARADOS.","3 - Siembra del hongo.","SIEMBRA DEL HONGO

Para la multiplicación se debe partir de un cultivo puro del hongo. La siembra consiste en tomar un trozo del cultivo puro y esporulado e introducirlo en las botellas con el medio esterilizado para que el hongo se multiplique. Para ello, se acondiciona un sitio de la casa de la finca donde no hayan corrientes de aire, que se pueda asear fácilmente y que en el momento de la siembra no sea frecuentado por muchas personas, ni animales.Este sitio debe tener una mesa de trabajo en la cual se re unan todos los materiales necesarios para la siembra del hongo como son: el cultivo puro que se va a emplear como inoculo o semilla, mecheros (2 a 4) con el fin de mantener una atmósfera libre de contaminantes, pinzas o alambres con la punta volteada, para realizar la siembra y alcohol antiséptico. Además, un marcador o cinta de enmascarar para marcar las botellas y un cuadro de registro para anotar la producción del hongo.

Las botellas que van a ser utilizadas para multiplicar el hongo deben estar a temperatura menor de 30°C ya que temperaturas mayores matan el hongo que se emplea como semilla o inoculo. Para iniciar la siembra se limpia la superficie de la mesa con alcohol o ""límpido"", se encienden los mecheros, se limpian las pinzas con alcohol y también con éste, se impregna un algodón donde consecutivamente se debe enfriar la pinza durante el proceso de siembra. 

Se toma entonces el cultivo puro con una mano y se retira el tapón con la otra, evitando cogerlo con toda la mano o depositarlo sobre la mesa. La pinza siempre que se vaya a introducir en la botella con el cultivo puro se flamea en la llama del mechero y se enfría con un algodón húmedo en alcohol. Para tomar la porción de hongo esporulado que va a servir de inoculo o semilla, se introduce la pinza, se toma un trozo de arroz esporulado y se retira rápidamente. Todo debe hacerse cerca a la llama del mechero. Se toma la botella que se va a sembrar, se destapa, se introduce el trozo retirado de la otra y se tapa de nuevo. Se repite el proceso para inocularlas otras botellas. 

IMPORTANTE.
La porción de inóculo debe ser de aproximadamente 1cm'. Con una sola porción la botella queda bien inoculada o sembrada y se evita tener que destaparla varias veces, con lo cual se crea un alto riesgo de contaminación.

Con una botella de cultivo puro del hongo se pueden sembrar en promedio unas 100 botellas para multiplicación. Las botellas que se esterilicen deben sembrarse el mismo día y la botella del cultivo puro que se utilice como inoculo o semilla no debe emplearse para hacer siembras en diferentes días, porque al haber sido abierta varias veces tiene una alta probabilidad de contaminación.

Terminado el proceso de siembra, las botellas inoculadas se marcan con un número que indique el lote, la fecha y la identificación de la cepa o aislamiento que se está multiplicando.Se debe registrar la producción del hongo para que el caficultor pueda evaluar los costos y la eficiencia con que está produciendo el hongo. 

CENICAFE"
"a1L36000003OHFZ","Producción de la finca.","Beauveria Bassiana.","Hongos.","ALTERNATIVAS DE BIOPREPARADOS.","M-0000000005","MI-0000000455","5","BIOPREPARADOS.","4 - Maduración del hongo.","MADURACIÓN DEL HONGO.
Las botellas sembradas se colocan en estantes o en un sitio limpio y seguro donde deben permanecer hasta que se observe un cubrimiento total del arroz por un crecimiento blanco. En este momento, el hongo está completamente desarrollado. El desarrollo de los cultivos es favorecido si la temperatura predominante del cuarto de maduración está entre 25 y 30°C. En estas condiciones los cultivos pueden completar su desarrollo en un promedio de doce días. 

El hongo, después de cubrir completamente el medio de cultivo, puede permanecer a temperatura ambiente un promedio de 30 días sin que se vea afectada su calidad (concentración, viabilidad y patogenicidad). Si después de transcurrido este tiempo el hongo no se ha aplicado en el campo, puede ser guardado en la parte baja de una nevera, a 4°C. En estas condiciones puede almacenarse hasta 6 meses sin que se afecte su calidad. 

IMPORTANTE.
Estos cultivos pueden desarrollar coloraciones amarillas o violetas que se deben al metabolismo del hongo y cuya función es inhibir el desarrollo de contaminantes en el medio. Esto no debe confundirse con el crecimiento de otros hongos contaminantes como Penicillium sp.,Aspergillus y Rhizopussp. que producen coloraciones verdes,negras, café y naranja . En ocasiones ,también se pueden presentar contaminaciones por levaduras y bacterias que imparten un aspecto líquido, cremoso y mal olor al medio de cultivo.

La contaminación puede deberse a errores cometidos en la siembra del hongo, a la presencia en el cultivo puro de contaminantes o a que el tapón de las botellas quedó flojo o fue muy manipulado. La contaminación por ácaros se presenta cuando en los estantes donde está madurando el hongo se deposita mucho polvo, o éste no se remueve periódicamente. La mejor forma de prevenir la presencia de ácaros es realizar aseo periódicamente.

Los cultivos con presencia de contaminantes no deben ser utilizados como semilla para producir nuevos cultivos del hongo. Deben descartarse y para hacerlo se vierte hipoclorito de sodio en las botellas con el fin de eliminar los agentes contaminantes. Después de transcurrido un tiempo mínimo de una hora se bota el contenido de la botella. Al destapar las botellas con contaminantes el operario debe colocarse un pañuelo en la nariz para no inhalar las conidias. Los hongos, bacterias y ácaros contaminantes de los medios de cultivo no atacan a las plantas de café. 

Para transportar las botellas con el hongo completamente desarrollado se deben tener unos cuidados mínimos. Si la botella tiene como destino iniciar nuevos cultivos, se debe envolver durante el transporte para que no le caiga polvo sobre el tapón lo cual ocasionaría riesgos de contaminación.En todos los casos, durante el transporte no se deben exponer al sol, ni permanecer en sitios muy calientes como el piso de los vehículos,porque las temperaturas altas son nocivas para el hongo. 

CENICAFE"
"a1L36000003OJOb","Producción de la finca.","Beauveria Bassiana.","Hongos.","ALTERNATIVAS DE BIOPREPARADOS.","M-0000000005","MI-0000000456","5","BIOPREPARADOS.","5 - Cosecha del hongo.","COSECHA DEL HONGO
Para la cosecha del hongo el primer paso consiste en agregarle a cada botella que contiene los 50 g de arroz, 10 ml de un aceite vegetal emulsionable de uso agrícola. La mayoría no tienen ningún efecto adverso sobrela viabilidad de las conidias. En pruebas de viabilidad con aceites se obtuvo una germinación del hongo superior al 80%,.Se busca con el uso de aceites proporcionar una película que proteja la conidia de la radiación solar y permita un mayor tiempo de sobrevivencia en el ambiente. Con una paleta de madera o un palo delgado se revuelve el arroz con el aceite en la botella hasta que se mezclen completamente, luego se adiciona agua y se agita fuertemente para crear una emulsión. 

Todo el contenido de la botella se vierte en un colador, cuya malla no permita el paso del arroz,colocado sobre un balde. El arroz se macera lavándolo con agua, evitando volverlo harina, ya que los pedazos muy finos pasarían a través de la malla y taparían las boquillas de los equipos de aspersión. La cantidad de agua con la cual se debe enjuagar el arroz de la botella es de 1 litro. Los residuos que quedan en el colador se arrojan en la gotera de los árboles de café, en los sitios de la finca donde se presentan mayores poblaciones de broca. 

CENICAFE"
